<?xml version="1.0" encoding="UTF-8"?>
<config xsi:schemaLocation="http://www.w3schools.com http://etalis.googlecode.com/files/XmlConfig.xsd" xmlns:xsi="http://www.w3.org/2001/XMLSchema-instance" xmlns="http://www.w3schools.com">

	<eventTriggers>
		<trigger>_/_</trigger>
	</eventTriggers>

	<eventRules>
		<eventRule>
			<consequence>c(X, Y)</consequence>
			<antecedent>a(X, _) seq b(Y, _)</antecedent>
		</eventRule>
	</eventRules>

	<providers>
		<provider type="input" class="com.jtalis.activemq.ActiveMQInputProvider">
			<parameters>
				<parameter name="url">tcp://localhost:61616</parameter>
				<parameter name="topic">JtalisInputEvent</parameter>
			</parameters>
		</provider>
		
		<provider regex="c" type="output" class="com.jtalis.activemq.ActiveMQOutputProvider">
			<parameters>
				<parameter name="url">tcp://localhost:61616</parameter>
				<parameter name="topic">JtalisFiredEvent</parameter>
			</parameters>
		</provider>
		<provider  type="output" class="com.jtalis.core.event.provider.DefaultOutputProvider">
		</provider>
	</providers>

</config>
