<?xml version="1.0" encoding="UTF-8"?>
<config xsi:schemaLocation="http://www.w3schools.com http://etalis.googlecode.com/files/XmlConfig.xsd" xmlns:xsi="http://www.w3.org/2001/XMLSchema-instance" xmlns="http://www.w3schools.com">
	<eventTriggers>
		<trigger>_/_</trigger>
	</eventTriggers>

	<eventRules>
		<eventRule>
			<consequence>c(X)</consequence>
			<antecedent>a(X) seq b(Y)</antecedent>
		</eventRule>
	</eventRules>

	<providers>
		<provider  type="input" class="com.jtalis.core.event.provider.DefaultInputProvider">
		</provider>
		<provider  type="output" class="com.jtalis.core.event.provider.XMLOutputProvider">
			<parameters>
				<parameter name="file">log-xml.event</parameter>
				<parameter name="xsd">SimpleEventSchema.xsd</parameter>
			</parameters>
		</provider>
	</providers>

</config>
